<?xml version="1.0" encoding="UTF-8"?>
<!DOCTYPE map-def SYSTEM "../../dtd/mapping_file.dtd">
<map-def name="SWING" version="1.0.0">
    <item key="camera">
        <path>/{NXinstrument}/{NXdetector}</path>
    </item>
    <item key="dark">
        <path>/{NXinstrument}/{NXdetector}/intensityBlack</path>
    </item>
    <item key="distance">
        <path>/{NXinstrument}/{NXdetector}/distance</path>
    </item>
    <item key="exposureTime">
        <path>/{NXinstrument}/{NXdetector}/Exposure</path>
    </item>
    <item key="shutterCloseDelay">
        <path>/{NXinstrument}/{NXdetector}/ShutterCloseDelay</path>
    </item>
    <item key="xBin">
        <path>/{NXinstrument}/{NXdetector}/Xbin</path>
    </item>
    <item key="yBin">
        <path>/{NXinstrument}/{NXdetector}/Ybin</path>
    </item>
    <item key="mi">
        <path>/{NXinstrument}/{NXintensity_monitor}</path>
    </item>
    <item key="gain">
        <path>/{NXinstrument}/{NXintensity_monitor}/Gain</path>
    </item>
    <item key="intensity">
        <path>/{NXinstrument}/{NXintensity_monitor}/intensity</path>
    </item>
    <item key="lambda">
        <path>/{NXinstrument}/{NXmonochromator}/wavelength</path>
    </item>
    <item key="energy">
        <path>/{NXinstrument}/{NXmonochromator}/energy</path>
    </item>
    <item key="spectrums">
        <path>/{NXdata}/data*</path>
        <call>DataItemStacker</call>
        <attribute name="interpretation" value="spectrum"/>
    </item>
    <item key="comments">
        <path>/{NXsample}/comments/data</path>
    </item>
</map-def>
