<?xml version="1.0" encoding="UTF-8"?>
<!DOCTYPE map-def SYSTEM "../../dtd/mapping_file.dtd">
<map-def name="TEMP_FLYSCAN" version="1.0.0">
  <item key="acquisition_sequence">
    <path>/{NXentry}</path>
    <call>CreateVirtualItem</call>
  </item>
  <item key="camera">
    <path>/{NXentry}/{NXinstrument}/{NXdetector}</path>
    <call>CreateVirtualItem</call>
    <call>HarvestEquipmentAttributes</call>
  </item>
  <item key="channelScale">
    <path>/{NXentry}/{NXinstrument}/{NXdetector}/channelScale</path>
    <call>HarvestEquipmentAttributes</call>
  </item>
  <item key="dark">
    <path>/{NXentry}/{NXinstrument}/{NXdetector}/intensityBlack</path>
    <call>HarvestEquipmentAttributes</call>
  </item>
  <item key="distance">
    <path>/{NXentry}/{NXinstrument}/{NXdetector}/distance</path>
    <call>HarvestEquipmentAttributes</call>
  </item>
  <item key="exposureTime">
    <path>/{NXentry}/{NXinstrument}/{NXdetector}/Exposure</path>
    <call>HarvestEquipmentAttributes</call>
  </item>
  <item key="shutterCloseDelay">
    <path>/{NXentry}/{NXinstrument}/{NXdetector}/ShutterCloseDelay</path>
    <call>HarvestEquipmentAttributes</call>
  </item>
  <item key="xBin">
    <path>/{NXentry}/{NXinstrument}/{NXdetector}/Xbin</path>
    <call>HarvestEquipmentAttributes</call>
  </item>
  <item key="yBin">
    <path>/{NXentry}/{NXinstrument}/{NXdetector}/Ybin</path>
    <call>HarvestEquipmentAttributes</call>
  </item>
  <item key="mi">
    <path>/{NXentry}/{NXinstrument}/{NXintensity_monitor}</path>
    <call>HarvestEquipmentAttributes</call>
  </item>
  <item key="gain">
    <path>/{NXentry}/{NXinstrument}/{NXintensity_monitor}/Gain</path>
    <call>HarvestEquipmentAttributes</call>
  </item>
  <item key="intensity">
    <path>/{NXentry}/{NXinstrument}/{NXintensity_monitor}/intensity</path>
    <call>HarvestEquipmentAttributes</call>
  </item>
  <item key="lambda">
    <path>/{NXentry}/{NXinstrument}/{NXmonochromator}/wavelength</path>
    <call>HarvestEquipmentAttributes</call>
  </item>
  <item key="energy">
    <path>/{NXentry}/{NXinstrument}/{NXmonochromator}/energy</path>
    <call>HarvestEquipmentAttributes</call>
  </item>
  <item key="spectrums_scienta">
    <path>/{NXentry}/{NXdata}/sumData*</path>
    <call>DataItemStackerByName</call>
    <call>HarvestSignalAttributes</call>
    <attribute name="equipment">
      <path>/{NXentry}/{NXinstrument}/Scienta*{NXdetector}</path>
      <call>HarvestEquipmentAttributes</call>
      <call>SelectNodeByRegionAttribute</call>
    </attribute>
    <attribute name="interpretation" value="spectrum"/>
  </item>
  <item key="spectrums_xia">
    <path>/{NXentry}/{NXdata}/channel*</path>
    <call>DataItemStackerByName</call>
    <call>HarvestSignalAttributes</call>
    <attribute name="equipment">
      <path>/{NXentry}/{NXinstrument}/Xia*{NXdetector}</path>
      <call>HarvestEquipmentAttributes</call>
      <call>SelectNodeByRegionAttribute</call>
    </attribute>
    <attribute name="interpretation" value="spectrum"/>
  </item>
  <item key="images">
    <path>/{NXentry}/{NXdata}/Image</path>
    <call>HarvestSignalAttributes</call>
    <attribute name="interpretation" value="image"/>
  </item>
  <item key="comments">
    <path>/{NXentry}/{NXsample}/comments/data</path>
    <call>HarvestEquipmentAttributes</call>
  </item>
</map-def>
