<?xml version="1.0" encoding="UTF-8"?>
<!DOCTYPE map-def SYSTEM "../../dtd/mapping_file.dtd">
<map-def name="ANTARES_PASSERELLE" version="1.0.0">
  <item key="acquisition_sequence">
    <path>/</path>
    <call>CreateVirtualItem</call>
  </item>
  <item key="camera">
    <path>/{NXinstrument}/{NXdetector}</path>
    <call>CreateVirtualItem</call>
    <call>HarvestEquipmentAttributes</call>
  </item>
  <item key="channelScale">
    <path>/{NXinstrument}/{NXdetector}/channelScale</path>
    <call>HarvestEquipmentAttributes</call>
  </item>
  <item key="dark">
    <path>/{NXinstrument}/{NXdetector}/intensityBlack</path>
    <call>HarvestEquipmentAttributes</call>
  </item>
  <item key="distance">
    <path>/{NXinstrument}/{NXdetector}/distance</path>
    <call>HarvestEquipmentAttributes</call>
  </item>
  <item key="exposureTime">
    <path>/{NXinstrument}/{NXdetector}/Exposure</path>
    <call>HarvestEquipmentAttributes</call>
  </item>
  <item key="shutterCloseDelay">
    <path>/{NXinstrument}/{NXdetector}/ShutterCloseDelay</path>
    <call>HarvestEquipmentAttributes</call>
  </item>
  <item key="xBin">
    <path>/{NXinstrument}/NXdetector}/Xbin</path>
    <call>HarvestEquipmentAttributes</call>
  </item>
  <item key="yBin">
    <path>/{NXinstrument}/{NXdetector}/Ybin</path>
    <call>HarvestEquipmentAttributes</call>
  </item>
  <item key="sweeps">
    <path>/{NXinstrument}/{NXdetector}/sweeps</path>
    <call>HarvestEquipmentAttributes</call>
  </item>
  <item key="acquisitionMode">
    <path>/{NXinstrument}/{NXdetector}/mode</path>
    <call>HarvestEquipmentAttributes</call>
  </item>
  <item key="lensMode">
    <path>/{NXinstrument}/{NXdetector}/lensMode</path>
    <call>HarvestEquipmentAttributes</call>
  </item>
  <item key="passEnergy">
    <path>/{NXinstrument}/{NXdetector}/passEnergy</path>
    <call>HarvestEquipmentAttributes</call>
  </item>
  <item key="lowEnergy">
    <path>/{NXinstrument}/{NXdetector}/lowEnergy</path>
    <call>HarvestEquipmentAttributes</call>
  </item>
  <item key="highEnergy">
    <path>/{NXinstrument}/{NXdetector}/highEnergy</path>
    <call>HarvestEquipmentAttributes</call>
  </item>
  <item key="energyStep">
    <path>/{NXinstrument}/{NXdetector}/energyStep</path>
    <call>HarvestEquipmentAttributes</call>
  </item>
  <item key="stepTime">
    <path>/{NXinstrument}/{NXdetector}/stepTime</path>
    <call>HarvestEquipmentAttributes</call>
  </item>
  <item key="firstXChannel">
    <path>/{NXinstrument}/{NXdetector}/detectorFirstXChannel</path>
    <call>HarvestEquipmentAttributes</call>
  </item>
  <item key="lastXChannel">
    <path>/{NXinstrument}/{NXdetector}/detectorLastXChannel</path>
    <call>HarvestEquipmentAttributes</call>
  </item>
  <item key="firstYChannel">
    <path>/{NXinstrument}/{NXdetector}/detectorFirstYChannel</path>
    <call>HarvestEquipmentAttributes</call>
  </item>
  <item key="lastYChannel">
    <path>/{NXinstrument}/{NXdetector}/detectorLastYChannel</path>
    <call>HarvestEquipmentAttributes</call>
  </item>
  <item key="slices">
    <path>/{NXinstrument}/{NXdetector}/slices</path>
    <call>HarvestEquipmentAttributes</call>
  </item>
  <item key="sliceScale">
    <path>/{NXinstrument}/{NXdetector}/sliceScale</path>
    <call>HarvestEquipmentAttributes</call>
  </item>
  <item key="energyScale">
    <path>/{NXinstrument}/{NXdetector}/energyScale</path>
    <call>HarvestEquipmentAttributes</call>
  </item>
  <item key="mi">
    <path>/{NXinstrument}/{NXintensity_monitor}</path>
    <call>HarvestEquipmentAttributes</call>
  </item>
  <item key="gain">
    <path>/{NXinstrument}/{NXintensity_monitor}/Gain</path>
    <call>HarvestEquipmentAttributes</call>
  </item>
  <item key="intensity">
    <path>/{NXinstrument}/{NXintensity_monitor}/intensity</path>
    <call>HarvestEquipmentAttributes</call>
  </item>
  <item key="lambda">
    <path>/{NXinstrument}/{NXmonochromator}/wavelength</path>
    <call>HarvestEquipmentAttributes</call>
  </item>
  <item key="energy">
    <path>/{NXinstrument}/{NXmonochromator}/energy</path>
    <call>HarvestEquipmentAttributes</call>
  </item>
  <item key="exitSlits">
    <path>/{NXinstrument}/{NXmonochromator}/exitSlitAperture</path>
    <call>HarvestEquipmentAttributes</call>
  </item>
  <item key="motor_name">
    <path>/{NXinstrument}/{NXpositioner}</path>
    <call>HarvestEquipmentAttributes</call>
  </item>
  <item key="motor_position">
    <path>/{NXinstrument}/{NXpositioner}/raw_value</path>
    <call>HarvestEquipmentAttributes</call>
  </item>
  <item key="dataChannelScale">
    <path>/{NXdata}/channelScale*</path>
    <!-- <call>DataItemStackerByName</call> -->
    <call>HarvestSignalAttributes</call>
    <attribute name="equipment">
      <path>/{NXinstrument}/Scienta*{NXdetector}</path>
      <call>HarvestEquipmentAttributes</call>
      <call>SelectNodeByRegionAttribute</call>
    </attribute>
  </item>
  <item key="samplePhi">
    <path>/{NXdata}/phi*</path>
    <call>DataItemStackerByName</call>
    <call>HarvestSignalAttributes</call>
  </item>
  <item key="sampleTheta">
    <path>/{NXdata}/Theta</path>
    <call>DataItemStackerByName</call>
    <call>HarvestSignalAttributes</call>
  </item>
  <item key="apertureAngle">
    <path>/{NXdata}/sliceScale*</path>
    <!-- <call>DataItemStackerByName</call> -->
    <call>HarvestSignalAttributes</call>
    <attribute name="equipment">
      <path>/{NXinstrument}/Scienta*{NXdetector}</path>
      <call>HarvestEquipmentAttributes</call>
      <call>SelectNodeByRegionAttribute</call>
    </attribute>
  </item>
  <item key="images">
    <path>/{NXdata}/data*</path>
    <call>DataItemStackerByName</call>
    <call>HarvestSignalAttributes</call>
    <attribute name="equipment">
      <path>/{NXinstrument}/Scienta*{NXdetector}</path>
      <call>HarvestEquipmentAttributes</call>
      <call>SelectNodeByRegionAttribute</call>
    </attribute>
    <attribute name="interpretation" value="image"/>
  </item>
  <item key="spectrums_scienta">
    <path>/{NXdata}/sumData*</path>
    <call>DataItemStackerByName</call>
    <call>HarvestSignalAttributes</call>
    <attribute name="equipment">
      <path>/{NXinstrument}/Scienta*{NXdetector}</path>
      <call>HarvestEquipmentAttributes</call>
      <call>SelectNodeByRegionAttribute</call>
    </attribute>
    <attribute name="interpretation" value="spectrum"/>
  </item>
  <item key="spectrums_xia">
    <path>/{NXdata}/channel*</path>
    <call>DataItemStackerByName</call>
    <call>HarvestSignalAttributes</call>
    <attribute name="equipment">
      <path>/{NXinstrument}/Xia*{NXdetector}</path>
      <call>HarvestEquipmentAttributes</call>
      <call>SelectNodeByRegionAttribute</call>
    </attribute>
    <attribute name="interpretation" value="spectrum"/>
  </item>
  <item key="total_spectrum">
    <path>/Scienta_Total{NXdata}/total_sum_data</path>
    <call>HarvestEquipmentAttributes</call>
  </item>
  <item key="total_image">
    <path>/Scienta_Total{NXdata}/total_data</path>
    <call>HarvestEquipmentAttributes</call>
  </item>
  <item key="comments">
    <path>/comment_conditions/data</path>
    <call>HarvestEquipmentAttributes</call>
  </item>
</map-def>
