<?xml version="1.0" encoding="UTF-8"?>
<!DOCTYPE map-def SYSTEM "../../dtd/mapping_file.dtd">
<map-def name="SWING_PASSERELLE" version="1.0.0">
  <item key="acquisition_sequence">
    <path>/</path>
    <call>CreateVirtualItem</call>
  </item>
  <item key="camera">
    <path>/{NXinstrument}/{NXdetector}</path>
    <call>CreateVirtualItem</call>
    <call>HarvestEquipmentAttributes</call>
  </item>
  <item key="channelScale">
    <path>/{NXinstrument}/{NXdetector}/channelScale</path>
    <call>HarvestEquipmentAttributes</call>
  </item>
  <item key="dark">
    <path>/{NXinstrument}/{NXdetector}/intensityBlack</path>
    <call>HarvestEquipmentAttributes</call>
  </item>
  <item key="distance">
    <path>/{NXinstrument}/{NXdetector}/distance</path>
    <call>HarvestEquipmentAttributes</call>
  </item>
  <item key="exposureTime">
    <path>/{NXinstrument}/{NXdetector}/Exposure</path>
    <call>HarvestEquipmentAttributes</call>
  </item>
  <item key="shutterCloseDelay">
    <path>/{NXinstrument}/{NXdetector}/ShutterCloseDelay</path>
    <call>HarvestEquipmentAttributes</call>
  </item>
  <item key="xBin">
    <path>/{NXinstrument}/{NXdetector}/Xbin</path>
    <call>HarvestEquipmentAttributes</call>
  </item>
  <item key="yBin">
    <path>/{NXinstrument}/{NXdetector}/Ybin</path>
    <call>HarvestEquipmentAttributes</call>
  </item>
  <item key="mi">
    <path>/{NXinstrument}/{NXintensity_monitor}</path>
    <call>CreateVirtualItem</call>
    <call>HarvestEquipmentAttributes</call>
  </item>
  <item key="gain">
    <path>/{NXinstrument}/{NXintensity_monitor}/Gain</path>
    <call>HarvestEquipmentAttributes</call>
  </item>
  <item key="intensity">
    <path>/{NXinstrument}/{NXintensity_monitor}/intensity</path>
    <call>HarvestEquipmentAttributes</call>
  </item>
  <item key="lambda">
    <path>/{NXinstrument}/{NXmonochromator}/wavelength</path>
    <call>HarvestEquipmentAttributes</call>
  </item>
  <item key="energy">
    <path>/{NXinstrument}/{NXmonochromator}/energy</path>
    <call>HarvestEquipmentAttributes</call>
  </item>
  <item key="images">
    <path>/image*{NXdata}/data</path>
    <call>DataItemStacker</call>
    <call>HarvestSignalAttributes</call>
    <attribute name="equipment">
      <path>/{NXinstrument}/{NXdetector}</path>
      <call>HarvestEquipmentAttributes</call>
    </attribute>
    <attribute name="interpretation" value="image"/>
  </item>
  <item key="comments">
    <path>/{NXsample}/comments/data</path>
    <call>HarvestEquipmentAttributes</call>
  </item>
</map-def>
